{
  "specVersion": "1",
  "requestId": "example.english-language",
  "title": "Build bounded English grammar tests and vocabulary recall activities",
  "targetSdk": "1",
  "audience": {
    "curriculum": "England; illustrative secondary study, not a confirmed school assignment",
    "level": "Ages 12–14 starting example; school year and exam scope must be configured",
    "languages": [
      "en-GB"
    ]
  },
  "sources": [
    {
      "id": "language-fixture",
      "version": "1",
      "path": "english-language-source.md",
      "sha256": "cdd4ab37e095bb06bcc14cbeeb250b8799082c9ce5b120480d430625262afd65",
      "locations": [
        {
          "id": "agreement",
          "kind": "section",
          "locator": "agreement"
        },
        {
          "id": "sentence-bank",
          "kind": "section",
          "locator": "sentence-bank"
        },
        {
          "id": "word-senses",
          "kind": "section",
          "locator": "word-senses"
        },
        {
          "id": "teaching",
          "kind": "section",
          "locator": "teaching"
        }
      ]
    }
  ],
  "objectives": [
    {
      "id": "english.subject-verb-agreement",
      "description": "Choose is/are to agree with the grammatical subject in the reviewed sentence bank.",
      "sourceRefs": [
        "language-fixture#agreement",
        "language-fixture#sentence-bank",
        "language-fixture#teaching"
      ]
    },
    {
      "id": "english.vocabulary-recall",
      "description": "Recall a listed scientific term for the supplied sense and context; do not infer spelling, production or science mastery.",
      "sourceRefs": [
        "language-fixture#word-senses",
        "language-fixture#teaching"
      ]
    }
  ],
  "moduleTargets": [
    {
      "id": "english-language.content",
      "version": "1.0.0",
      "kind": "content",
      "objectiveIds": [
        "english.subject-verb-agreement",
        "english.vocabulary-recall"
      ],
      "dependencyIds": [],
      "contentRequirements": [
        "Explain agreement using head nouns and contrasting reviewed examples; preserve standard-written-English scope.",
        "Provide three sense records and six reviewed prompts exactly as supplied; preserve IDs and distinguish definition/context prompts.",
        "Describe one-mark binary rubrics agreement and recall-term, variant normalisation and unsupported cases.",
        "Keep expansion suggestions separate from exam lists; explain that this finite bank does not establish broad transfer."
      ]
    },
    {
      "id": "english-language.dynamic",
      "version": "1.0.0",
      "kind": "dynamic",
      "objectiveIds": [
        "english.subject-verb-agreement",
        "english.vocabulary-recall"
      ],
      "dependencyIds": [
        "english-language.content"
      ],
      "families": [
        {
          "id": "present-be-agreement",
          "objectiveIds": [
            "english.subject-verb-agreement"
          ],
          "modes": [
            "learn",
            "diagnostic",
            "practice",
            "review",
            "mock-exam"
          ],
          "views": [
            "text"
          ],
          "generation": {
            "parameterDomain": "Six supplied subject IDs multiplied by two predicate IDs = 12 sentences.",
            "algorithm": "Select compatible subject/predicate entries with a versioned seeded PRNG; preserve exact text and private head/number metadata.",
            "constraints": [
              "Use only the supplied bank and is/are alternatives; no invented sentence fragments.",
              "Return unavailable for unsupported tense/register/structure or scope.",
              "Keep subject head and correct form private until authorised help/feedback."
            ],
            "difficultyDimensions": [
              "Simple head versus intervening phrase",
              "Matching versus conflicting number of nearby nouns"
            ],
            "seeded": true
          },
          "assessment": {
            "responseContract": "JSON string containing is or are after trimming and ASCII case folding. Other words or full sentences are unassessed.",
            "checkerStrategy": "Use reviewed subject number to select the required form; never use the nearest noun heuristic.",
            "rules": [
              "One binary criterion agreement, one mark.",
              "Supported alternative is/are with wrong agreement is incorrect; malformed or unsupported input is unassessed.",
              "Do not award production or general grammar mastery from cloze alone."
            ],
            "onUnsupported": "unassessed",
            "cases": [
              {
                "id": "singular-head",
                "parameters": {
                  "subjectId": "s-box",
                  "predicateId": "p-desk"
                },
                "response": "is",
                "expected": "correct",
                "reason": "Head box is singular despite nearby plural pencils."
              },
              {
                "id": "nearest-noun-error",
                "parameters": {
                  "subjectId": "s-key",
                  "predicateId": "p-desk"
                },
                "response": "are",
                "expected": "incorrect",
                "reason": "Head key is singular, not books."
              },
              {
                "id": "plural-head",
                "parameters": {
                  "subjectId": "s-keys",
                  "predicateId": "p-window"
                },
                "response": "are",
                "expected": "correct",
                "reason": "Head keys is plural despite nearby singular book."
              },
              {
                "id": "normalisation",
                "parameters": {
                  "subjectId": "s-lamps",
                  "predicateId": "p-desk"
                },
                "response": " ARE ",
                "expected": "correct",
                "reason": "Declared whitespace/case normalisation preserves are."
              },
              {
                "id": "whole-sentence",
                "parameters": {
                  "subjectId": "s-lamp",
                  "predicateId": "p-window"
                },
                "response": "The lamp is near the window.",
                "expected": "unassessed",
                "reason": "This response contract requests only the missing word."
              },
              {
                "id": "unsupported-form",
                "parameters": {
                  "subjectId": "s-boxes",
                  "predicateId": "p-desk"
                },
                "response": "were",
                "expected": "unassessed",
                "reason": "Only is/are is supported; prompt for the requested format."
              }
            ]
          },
          "interactionRequirements": [
            "Learn mode can reveal the head and explain why nearby nouns do not control agreement; record help.",
            "In mock mode show the same sentence with a blank and unranked is/are choices; no grammatical highlighting or live feedback.",
            "Use native text initially; advanced token editing requires a declared custom view, never an invented native scene."
          ],
          "transferRequirement": "Hold back different subject/predicate combinations and retain structure IDs. Label exhausted/reused variants. Broader editing and writing transfer require another validated family."
        },
        {
          "id": "scientific-term-recall",
          "objectiveIds": [
            "english.vocabulary-recall"
          ],
          "modes": [
            "learn",
            "diagnostic",
            "practice",
            "review",
            "mock-exam"
          ],
          "views": [
            "text"
          ],
          "generation": {
            "parameterDomain": "Three supplied sense IDs multiplied by two context IDs d/c = six prompts.",
            "algorithm": "Choose a sense/context pair from the frozen approved list using a seeded PRNG; prepend the exact recall instruction. The independent prompt does not display the answer list.",
            "constraints": [
              "Only supplied senses and reviewed prompts; generated extra words never enter exam scope.",
              "No runtime synonym invention or unrestricted definition grading.",
              "Keep sense ID and expected term in private state: student-facing state exposes only the recall instruction and context prompt; hide the word list during independent recall."
            ],
            "difficultyDimensions": [
              "Direct definition versus contextual cue"
            ],
            "seeded": true
          },
          "assessment": {
            "responseContract": "JSON string from mass, volume, density after trimming and ASCII case folding. Other text is unassessed.",
            "checkerStrategy": "Match the supported listed response to the private reviewed sense key; preserve separate objective/sense/context evidence.",
            "rules": [
              "One binary criterion recall-term, one mark.",
              "Another listed term is incorrect; other text is unassessed for this bounded task.",
              "No spelling, productive-use or science-calculation evidence is awarded by this family."
            ],
            "onUnsupported": "unassessed",
            "cases": [
              {
                "id": "density-recall",
                "parameters": {
                  "senseId": "density.ratio",
                  "contextId": "d"
                },
                "response": "density",
                "expected": "correct",
                "reason": "Correct supplied term for mass divided by volume."
              },
              {
                "id": "wrong-listed-term",
                "parameters": {